{
  "schemaVersion": 1,
  "releaseLine": "v0.2",
  "releaseVersion": "0.2.0",
  "taskId": "V2-M0-02",
  "implementationManifestSha256": "da315d618bde8cb68973ff757d8718104e70c285914baa0c0475578064ee1e98",
  "toolchainManifestSha256": "42ab91fc7d0fabdae324b9b6baf1e38639e7b0843e2ab413cea5123580f712eb",
  "productContractManifestSha256": "951663d67aea11d35610b67f2ba568b1a7a001ce0a23e6c2cc576bb7131a2e0b",
  "entries": [
    {
      "logicalPath": "LICENSE",
      "archivePath": "LICENSE",
      "sourcePath": "distribution/build/v0.2/components/LICENSE",
      "sourceGitPath": "LICENSE",
      "sourceGitBlobSha1": "261eeb9e9f8b2b4b0d119366dda99c6fd7d35c64",
      "mode": "100644",
      "sizeBytes": 11558,
      "sha256": "1eb85fc97224598dad1852b5d6483bbcf0aa8608790dcc657a5a2a761ae9c8c6",
      "role": "license",
      "variant": "source",
      "abi": null,
      "platform": "all"
    },
    {
      "logicalPath": "THIRD_PARTY_NOTICES.md",
      "archivePath": "THIRD_PARTY_NOTICES.md",
      "sourcePath": "distribution/build/v0.2/components/THIRD_PARTY_NOTICES.md",
      "sourceGitPath": "THIRD_PARTY_NOTICES.md",
      "sourceGitBlobSha1": "712a7d8cf035e7916b7cc3e7dff7cc787633f157",
      "mode": "100644",
      "sizeBytes": 4612,
      "sha256": "8ad2c4a9f6b441e85db4752a5cd9fe0ec08f40f590be0b5842af34e4ae61da8c",
      "role": "third-party-notices",
      "variant": "source",
      "abi": null,
      "platform": "all"
    },
    {
      "logicalPath": "bin/android-app-hardening",
      "archivePath": "bin/android-app-hardening",
      "sourcePath": "distribution/build/v0.2/components/ubuntu/bin/android-app-hardening",
      "sourceGitPath": "distribution/src/main/resources/v0.2/ubuntu/android-app-hardening",
      "sourceGitBlobSha1": "e13e3ed56b4ec00fa081ad00b233633f2e57bb1e",
      "mode": "100755",
      "sizeBytes": 1200,
      "sha256": "c7c9b8f6101cf452ab541fe2d531acddc4e57649b126c1a73039397989c30db9",
      "role": "launcher",
      "variant": "ubuntu",
      "abi": null,
      "platform": "ubuntu"
    },
    {
      "logicalPath": "bin/android-app-hardening.cmd",
      "archivePath": "bin/android-app-hardening.cmd",
      "sourcePath": "distribution/build/v0.2/components/windows/bin/android-app-hardening.cmd",
      "sourceGitPath": "distribution/src/main/resources/v0.2/windows/android-app-hardening.cmd",
      "sourceGitBlobSha1": "92b75745f70d86ac43dabdb86d43345e31cff911",
      "mode": "100755",
      "sizeBytes": 1123,
      "sha256": "944c6ea71b2a0e6c0aea8bbbda53b86dfb9e80ce789a4adcd4c366006ddf8234",
      "role": "launcher",
      "variant": "windows",
      "abi": null,
      "platform": "windows"
    },
    {
      "logicalPath": "bom.cdx.json",
      "archivePath": "bom.cdx.json",
      "sourcePath": "distribution/build/v0.2/components/bom.cdx.json",
      "sourceGitPath": "distribution/src/main/kotlin/ah/distribution/V02ComponentBaselineValidator.kt",
      "sourceGitBlobSha1": "ada8498776ff6291d06a1bfa4e28e267d6c74e48",
      "mode": "100644",
      "sizeBytes": 390,
      "sha256": "ae3867f83f6869ad01e258b74f0868665fbb0f11e2d2f49f592f6ee91ffe6ad5",
      "role": "sbom-slot",
      "variant": "synthetic-canary",
      "abi": null,
      "platform": "all"
    },
    {
      "logicalPath": "contract/archive-byte-contract-v1.json",
      "archivePath": null,
      "sourcePath": "distribution/src/main/resources/v0.2/schemas/archive-byte-contract-v1.json",
      "sourceGitPath": "distribution/src/main/resources/v0.2/schemas/archive-byte-contract-v1.json",
      "sourceGitBlobSha1": "827c5b9234ccd2668ab05ba7345cf160ce1b274a",
      "mode": "100644",
      "sizeBytes": 2290,
      "sha256": "36f776f2d572414b9fd9fef5f6b45000822b9e45ae5b395ac1b6f0dcb5b3d62c",
      "role": "archive-contract",
      "variant": "contract",
      "abi": null,
      "platform": "contract"
    },
    {
      "logicalPath": "contract/component-baseline-v1.schema.json",
      "archivePath": null,
      "sourcePath": "distribution/src/main/resources/v0.2/schemas/component-baseline-v1.schema.json",
      "sourceGitPath": "distribution/src/main/resources/v0.2/schemas/component-baseline-v1.schema.json",
      "sourceGitBlobSha1": "c7bf611ba367bfc9655096b7319cd526409073e8",
      "mode": "100644",
      "sizeBytes": 2077,
      "sha256": "81fc1e0102dda9dfa830609e3ac70aeda25a694a9909941bf6d8638dd2f33836",
      "role": "component-baseline-schema",
      "variant": "contract",
      "abi": null,
      "platform": "contract"
    },
    {
      "logicalPath": "contract/component-manifest-v1.schema.json",
      "archivePath": null,
      "sourcePath": "distribution/src/main/resources/v0.2/schemas/component-manifest-v1.schema.json",
      "sourceGitPath": "distribution/src/main/resources/v0.2/schemas/component-manifest-v1.schema.json",
      "sourceGitBlobSha1": "4f2157bb2c0428338dd4a61cadc0191d6b321d7a",
      "mode": "100644",
      "sizeBytes": 2023,
      "sha256": "7cece1232ecaeddce1b09698821b0a24094a3b361495021241ec5abb81c8defb",
      "role": "component-manifest-schema",
      "variant": "contract",
      "abi": null,
      "platform": "contract"
    },
    {
      "logicalPath": "contract/provenance-v1.schema.json",
      "archivePath": null,
      "sourcePath": "distribution/src/main/resources/v0.2/schemas/provenance-v1.schema.json",
      "sourceGitPath": "distribution/src/main/resources/v0.2/schemas/provenance-v1.schema.json",
      "sourceGitBlobSha1": "0764c905d9364ac426b0a53dc480b8cea2478936",
      "mode": "100644",
      "sizeBytes": 693,
      "sha256": "5417a8f320d9edafea9cb3d200f7b242bd931f18dbfe87a0d202626705608a4f",
      "role": "provenance-schema",
      "variant": "contract",
      "abi": null,
      "platform": "contract"
    },
    {
      "logicalPath": "contract/release-manifest-v1.schema.json",
      "archivePath": null,
      "sourcePath": "distribution/src/main/resources/v0.2/schemas/release-manifest-v1.schema.json",
      "sourceGitPath": "distribution/src/main/resources/v0.2/schemas/release-manifest-v1.schema.json",
      "sourceGitBlobSha1": "8fc1b53f54bab2532fdcfcee14dafe508ee501c3",
      "mode": "100644",
      "sizeBytes": 1117,
      "sha256": "d5461c79fcd4b830d7dcaa45ccfa7a7e1f2cbb3225d5fcca2de4821635528855",
      "role": "release-manifest-schema",
      "variant": "contract",
      "abi": null,
      "platform": "contract"
    },
    {
      "logicalPath": "contract/v02-component-baseline-validator.kt",
      "archivePath": null,
      "sourcePath": "distribution/src/main/kotlin/ah/distribution/V02ComponentBaselineValidator.kt",
      "sourceGitPath": "distribution/src/main/kotlin/ah/distribution/V02ComponentBaselineValidator.kt",
      "sourceGitBlobSha1": "ada8498776ff6291d06a1bfa4e28e267d6c74e48",
      "mode": "100644",
      "sizeBytes": 38989,
      "sha256": "a98cc9410fcc78dc888bcd75741a1d914deb41067c945176ea3d1f84b6ae3e4b",
      "role": "baseline-validator",
      "variant": "contract",
      "abi": null,
      "platform": "contract"
    },
    {
      "logicalPath": "contract/v02-release-packager.kt",
      "archivePath": null,
      "sourcePath": "distribution/src/main/kotlin/ah/distribution/V02ReleasePackager.kt",
      "sourceGitPath": "distribution/src/main/kotlin/ah/distribution/V02ReleasePackager.kt",
      "sourceGitBlobSha1": "e462e42c05dc351023626b39b7dbb4c54c73df48",
      "mode": "100644",
      "sizeBytes": 35993,
      "sha256": "5b2828bdc37fc4144706cc1c3901131961970f5a4f8540ad205a60aa0ca735c6",
      "role": "release-packager",
      "variant": "contract",
      "abi": null,
      "platform": "contract"
    },
    {
      "logicalPath": "docs/QUICKSTART.md",
      "archivePath": "docs/QUICKSTART.md",
      "sourcePath": "distribution/build/v0.2/components/docs/QUICKSTART.md",
      "sourceGitPath": "distribution/docs/QUICKSTART.md",
      "sourceGitBlobSha1": "59101ece7989970c166936f6cc55f0bd0058c63d",
      "mode": "100644",
      "sizeBytes": 1126,
      "sha256": "b37b026c5e7632b27a285c13d89d58bed001ce184ee6c5ee6fbe2091ea0689a1",
      "role": "quickstart",
      "variant": "archive-internal",
      "abi": null,
      "platform": "all"
    },
    {
      "logicalPath": "lib/android-app-hardening.jar",
      "archivePath": "lib/android-app-hardening.jar",
      "sourcePath": "distribution/build/v0.2/components/lib/android-app-hardening.jar",
      "sourceGitPath": "distribution/build.gradle.kts",
      "sourceGitBlobSha1": "3cc300a14b355a7d8c1a026c3571d45511a66cb1",
      "mode": "100644",
      "sizeBytes": 6954708,
      "sha256": "c8b25d8ca8a17fdf94b4799d76baebb0379b1cec7233504367a7442e9c83dc56",
      "role": "host-release",
      "variant": "release",
      "abi": null,
      "platform": "all"
    },
    {
      "logicalPath": "release-manifest.json@ubuntu",
      "archivePath": "release-manifest.json",
      "sourcePath": "distribution/build/v0.2/components/ubuntu/release-manifest.json",
      "sourceGitPath": "distribution/src/main/kotlin/ah/distribution/V02ComponentBaselineValidator.kt",
      "sourceGitBlobSha1": "ada8498776ff6291d06a1bfa4e28e267d6c74e48",
      "mode": "100644",
      "sizeBytes": 2372,
      "sha256": "9fa8ea2c96527425685ce29e89aa68a001f57768d6d3fee92b841719cf46585c",
      "role": "release-manifest",
      "variant": "ubuntu",
      "abi": null,
      "platform": "ubuntu"
    },
    {
      "logicalPath": "release-manifest.json@windows",
      "archivePath": "release-manifest.json",
      "sourcePath": "distribution/build/v0.2/components/windows/release-manifest.json",
      "sourceGitPath": "distribution/src/main/kotlin/ah/distribution/V02ComponentBaselineValidator.kt",
      "sourceGitBlobSha1": "ada8498776ff6291d06a1bfa4e28e267d6c74e48",
      "mode": "100644",
      "sizeBytes": 2377,
      "sha256": "e1df008033a4ddcf5ec28ab8ab984ca3f19fce69f88de27b7633f7d64a2e1ac9",
      "role": "release-manifest",
      "variant": "windows",
      "abi": null,
      "platform": "windows"
    },
    {